{
  "schema_version": "1.0",
  "status": "confirmed",
  "project": {
    "name": "Greeting CLI",
    "summary": "A tiny local Python command that prints an exact greeting and rejects arguments."
  },
  "artifacts": {
    "project_intent": {
      "path": "docs/architecture/project-intent.md",
      "sha256": "b95f7a9bb6a8c3cd752f1429b3e34c8ec53089283e394b9b172d5b416dd8b704",
      "bytes": 1691
    },
    "architecture_map": {
      "path": "docs/architecture/architecture-map.json",
      "sha256": "ff972ad86a8cc1a93222e024c8f1cbc11b6b055970e21f004b4b7e6c9af58460",
      "bytes": 3372
    },
    "c4_projection": {
      "path": "docs/architecture/workspace.dsl",
      "sha256": "e26681ab47525dd7eaa7fd70c3bd78221e8bc13e8287233b6dffe0e02ccfc58e",
      "bytes": 1188
    }
  },
  "evidence": [
    {
      "id": "e-behavior",
      "source": "project_intent",
      "locator": "Required behavior",
      "summary": "The command output, exit codes, runtime, and test expectations are explicit."
    },
    {
      "id": "e-actor",
      "source": "project_intent",
      "locator": "Explicit boundaries",
      "summary": "A single local maintainer is the only actor."
    },
    {
      "id": "e-boundaries",
      "source": "project_intent",
      "locator": "Explicit boundaries",
      "summary": "Networked, persistent, deployed, and third-party surfaces are excluded."
    },
    {
      "id": "e-slice",
      "source": "architecture_map",
      "locator": "views[domain-context]",
      "summary": "The complete greeting journey forms one candidate bounded context and slice."
    }
  ],
  "facts": [
    {
      "id": "fact-runtime",
      "statement": "The application uses Python 3.13 and only its standard library.",
      "evidence": ["e-behavior"]
    },
    {
      "id": "fact-command",
      "statement": "The module prints exactly one greeting for an argument-free invocation.",
      "evidence": ["e-behavior"]
    }
  ],
  "scope": {
    "included": [
      {
        "id": "scope-cli",
        "statement": "Implement and verify the local greeting command and invalid-argument path.",
        "evidence": ["e-behavior"]
      }
    ],
    "excluded": [
      {
        "id": "scope-external",
        "statement": "Browser, API, network, identity, persistence, deployment, and third-party dependencies are excluded.",
        "evidence": ["e-boundaries"]
      }
    ],
    "deferred": [
      {
        "id": "scope-remote",
        "statement": "CI and remote evidence remain deferred until a remote or multi-contributor surface exists.",
        "evidence": ["e-behavior"]
      }
    ]
  },
  "actors": [
    {
      "id": "actor-maintainer",
      "statement": "One local maintainer invokes and verifies the command.",
      "evidence": ["e-actor"]
    }
  ],
  "journeys": [
    {
      "id": "journey-greeting",
      "statement": "The maintainer invokes the module and receives the exact greeting or a concise usage error.",
      "evidence": ["e-behavior", "e-actor"]
    }
  ],
  "quality_requirements": [
    {
      "id": "quality-exactness",
      "statement": "Automated tests prove exact standard output, standard error, and exit codes.",
      "evidence": ["e-behavior"]
    }
  ],
  "integrations": [],
  "choices": [
    {
      "id": "choice-runtime",
      "decision": "Use any available Python 3.13 patch and only the standard library.",
      "source": "explicit-intake",
      "rationale": "The user explicitly selected the runtime line and dependency boundary.",
      "evidence": ["e-behavior"]
    },
    {
      "id": "choice-tests",
      "decision": "Use unittest and subprocess with unittest discovery as the aggregate gate.",
      "source": "explicit-intake",
      "rationale": "The verification approach is explicit and adds no external dependency.",
      "evidence": ["e-behavior"]
    }
  ],
  "capability_assessments": [
    {
      "id": "capability-slicing",
      "need": "Shape the complete greeting journey as an independently verifiable vertical slice.",
      "coverage": "guided",
      "program_kit_capability": "vertical-slicing",
      "disposition": "program-kit-default",
      "evidence": ["e-slice"]
    },
    {
      "id": "capability-python",
      "need": "Implement and verify a Python 3.13 standard-library command.",
      "coverage": "external",
      "program_kit_capability": "",
      "disposition": "project-owned-design",
      "evidence": ["e-behavior"]
    }
  ],
  "open_items": [],
  "candidate_slice_signals": [
    {
      "id": "slice-greeting",
      "statement": "The first slice is the complete argument-free and invalid-argument greeting journey.",
      "evidence": ["e-slice", "e-behavior"]
    }
  ],
  "routing": {
    "languages": ["Python 3.13"],
    "frameworks": ["Python standard library"],
    "interfaces": ["Command line"],
    "included_surfaces": ["Local process", "Standard output", "Standard error"],
    "excluded_surfaces": ["Web", "HTTP API", "Network", "Identity", "Persistence", "Deployment"],
    "capabilities": ["vertical-slicing", "architecture-governance", "guardrails"]
  }
}
